{
  "inventory_id": "a00a72de-e16f-4b2c-a7ba-ab31b31df060",
  "generated_at": "2026-09-06T14:57:03.093685+00:00",
  "target": {
    "path": "/home/runner/work/ai-governance-readiness-workbench/ai-governance-readiness-workbench/repo",
    "git_head": "b246b15dd5a0aca106499efd1c59de2764f3368f",
    "git_remote": "https://github.com/yencwu87-ui/ai-governance-readiness-workbench"
  },
  "sources": {
    "environment_scan": {
      "adapter": "environment_scan",
      "status": "ok",
      "message": "",
      "records": [
        {
          "path": "requirements.txt",
          "kind": "dependencies",
          "hint": "Python dependency manifest \u2014 third-party AI libraries and pinned versions",
          "controls": [
            "M3",
            "A.10"
          ],
          "sha256": "37d903265c975af8a94873ea613aa5b58c82a25c0e7b54d4d9d4a4640f805376"
        },
        {
          "path": "test_assessor.py",
          "kind": "evaluation",
          "hint": "Test artefacts",
          "controls": [
            "D3.1",
            "M4"
          ],
          "sha256": "bd1a9f72264abb179860759b888ddb461b58b69ea3eb18f49f4849d4280140e8"
        },
        {
          "path": "MODEL_CARD.md",
          "kind": "model-doc",
          "hint": "Model card \u2014 documentation of intended use, limits and evaluation",
          "controls": [
            "D1.1",
            "M2",
            "A.6.2",
            "MAP 1.1"
          ],
          "sha256": "0dbd2d5b75a498fc71ec5571ac17e0f245c055d73ef0276b4d83a35b7dcccd29"
        },
        {
          "path": ".streamlit/secrets.toml.example",
          "kind": "secrets",
          "hint": "Secrets-related file \u2014 verify it is a reference, not plaintext credentials",
          "controls": [
            "S1.3",
            "D2.2"
          ],
          "sha256": "a7145b6e4facacd96d90f1d2f60829d4f9a5fca7889d061e0e5e91845f38dd57"
        },
        {
          "path": "tests/test_step8.py",
          "kind": "evaluation",
          "hint": "Test artefacts",
          "controls": [
            "D3.1",
            "M4"
          ],
          "sha256": "76d85e1a568865e075e714bd10b2d9f0c8faf91dd4428a84b4a2ce03d0c62d47"
        },
        {
          "path": "governance/eval_results.json",
          "kind": "evaluation",
          "hint": "Evaluation artefacts \u2014 tests or golden sets for model behaviour",
          "controls": [
            "D3.1",
            "M4",
            "MEASURE 2"
          ],
          "sha256": "af088e020f18fcb9decaba77659921e58b7182524cc0813b6cc4a46eb4944828"
        },
        {
          "path": "schemas/inventory.schema.json",
          "kind": "inventory",
          "hint": "Inventory register \u2014 agent/model registration evidence",
          "controls": [
            "S1.1",
            "M1.3",
            "A.9"
          ],
          "sha256": "dc158723bcfd9c4cae21c2e226b3c6ad78a76955e95cfc7ba6507649d25e1314"
        },
        {
          "path": "sample_evidence/records/AI_inventory_extract_Aug2026.docx",
          "kind": "inventory",
          "hint": "Inventory register \u2014 agent/model registration evidence",
          "controls": [
            "S1.1",
            "M1.3",
            "A.9"
          ],
          "sha256": "dfc9c464135fc9eb2f740bd3f3eed32cd8b9b575b5c0231cbcec0b7de05e93c3"
        },
        {
          "path": "sample_evidence/infra/agent_logging_config.yaml",
          "kind": "logging",
          "hint": "Logging configuration \u2014 check what agent actions are captured and retained",
          "controls": [
            "S4.1",
            "D4.1",
            "M5"
          ],
          "sha256": "a0efd40090a9753473d07bcc1b93dfbb611de06a0d4d1629eb28ca76635c96db"
        },
        {
          "path": "sample_evidence/infra/.env",
          "kind": "secrets",
          "hint": "Environment file \u2014 secrets may be stored in plaintext; must not be in evidence or repos",
          "controls": [
            "S1.3",
            "D2.2"
          ],
          "sha256": "7169412703c3edbf2de7c2dcd1fb1476dea91d7c951621eb2e3b79c06a3d174e"
        },
        {
          "path": "stress/hotspots/h03_agent_promptfoo.py",
          "kind": "prompt",
          "hint": "Prompt/system-prompt files \u2014 governed as configuration? versioned? reviewed?",
          "controls": [
            "D2.3",
            "S2.2",
            "M2"
          ],
          "sha256": "9f2ed7651c007a6577c8c760ebd80085e4364bce1038d9269ac55fe01f5b82ec"
        },
        {
          "path": "stress/corpora/h03_promptfoo.yaml",
          "kind": "prompt",
          "hint": "Prompt/system-prompt files \u2014 governed as configuration? versioned? reviewed?",
          "controls": [
            "D2.3",
            "S2.2",
            "M2"
          ],
          "sha256": "cc4c95c9c7e256ed89dffda33f82604312403499992eb2e5ca4e81059ce8f67f"
        }
      ],
      "artefacts": [
        {
          "ref": "/home/runner/work/ai-governance-readiness-workbench/ai-governance-readiness-workbench/repo/requirements.txt",
          "sha256": "37d903265c975af8a94873ea613aa5b58c82a25c0e7b54d4d9d4a4640f805376",
          "bytes": 187
        },
        {
          "ref": "/home/runner/work/ai-governance-readiness-workbench/ai-governance-readiness-workbench/repo/test_assessor.py",
          "sha256": "bd1a9f72264abb179860759b888ddb461b58b69ea3eb18f49f4849d4280140e8",
          "bytes": 1478
        },
        {
          "ref": "/home/runner/work/ai-governance-readiness-workbench/ai-governance-readiness-workbench/repo/MODEL_CARD.md",
          "sha256": "0dbd2d5b75a498fc71ec5571ac17e0f245c055d73ef0276b4d83a35b7dcccd29",
          "bytes": 2872
        },
        {
          "ref": "/home/runner/work/ai-governance-readiness-workbench/ai-governance-readiness-workbench/repo/.streamlit/secrets.toml.example",
          "sha256": "a7145b6e4facacd96d90f1d2f60829d4f9a5fca7889d061e0e5e91845f38dd57",
          "bytes": 33
        },
        {
          "ref": "/home/runner/work/ai-governance-readiness-workbench/ai-governance-readiness-workbench/repo/tests/test_step8.py",
          "sha256": "76d85e1a568865e075e714bd10b2d9f0c8faf91dd4428a84b4a2ce03d0c62d47",
          "bytes": 6724
        },
        {
          "ref": "/home/runner/work/ai-governance-readiness-workbench/ai-governance-readiness-workbench/repo/governance/eval_results.json",
          "sha256": "af088e020f18fcb9decaba77659921e58b7182524cc0813b6cc4a46eb4944828",
          "bytes": 604
        },
        {
          "ref": "/home/runner/work/ai-governance-readiness-workbench/ai-governance-readiness-workbench/repo/schemas/inventory.schema.json",
          "sha256": "dc158723bcfd9c4cae21c2e226b3c6ad78a76955e95cfc7ba6507649d25e1314",
          "bytes": 1828
        },
        {
          "ref": "/home/runner/work/ai-governance-readiness-workbench/ai-governance-readiness-workbench/repo/sample_evidence/records/AI_inventory_extract_Aug2026.docx",
          "sha256": "dfc9c464135fc9eb2f740bd3f3eed32cd8b9b575b5c0231cbcec0b7de05e93c3",
          "bytes": 37115
        },
        {
          "ref": "/home/runner/work/ai-governance-readiness-workbench/ai-governance-readiness-workbench/repo/sample_evidence/infra/agent_logging_config.yaml",
          "sha256": "a0efd40090a9753473d07bcc1b93dfbb611de06a0d4d1629eb28ca76635c96db",
          "bytes": 29
        },
        {
          "ref": "/home/runner/work/ai-governance-readiness-workbench/ai-governance-readiness-workbench/repo/sample_evidence/infra/.env",
          "sha256": "7169412703c3edbf2de7c2dcd1fb1476dea91d7c951621eb2e3b79c06a3d174e",
          "bytes": 4
        },
        {
          "ref": "/home/runner/work/ai-governance-readiness-workbench/ai-governance-readiness-workbench/repo/stress/hotspots/h03_agent_promptfoo.py",
          "sha256": "9f2ed7651c007a6577c8c760ebd80085e4364bce1038d9269ac55fe01f5b82ec",
          "bytes": 2861
        },
        {
          "ref": "/home/runner/work/ai-governance-readiness-workbench/ai-governance-readiness-workbench/repo/stress/corpora/h03_promptfoo.yaml",
          "sha256": "cc4c95c9c7e256ed89dffda33f82604312403499992eb2e5ca4e81059ce8f67f",
          "bytes": 765
        }
      ]
    },
    "git_log": {
      "adapter": "git_log",
      "status": "ok",
      "message": "",
      "records": [
        {
          "commit": "b246b15dd5a0aca106499efd1c59de2764f3368f",
          "author": "Yen-Ching Wu",
          "email": "yencwu87@gmail.com",
          "date": "2026-09-06T22:56:51+08:00",
          "message": "WB-016: policy/ is a governed path",
          "ticket_ref": "WB-016",
          "paths": [
            "audit.yaml"
          ],
          "touches_governed_paths": false
        },
        {
          "commit": "c5977416cfa590713cc195d238fd919ebae8c06a",
          "author": "Yen-Ching Wu",
          "email": "yencwu87@gmail.com",
          "date": "2026-09-06T22:55:46+08:00",
          "message": "WB-016: policy versioning and change control",
          "ticket_ref": "WB-016",
          "paths": [
            "audit.yaml",
            "caa/adapters/policy_state.py",
            "caa/policy.py",
            "controls/governance.yaml",
            "governance/tickets.csv",
            "policy/POLICY.md",
            "policy/ai-lifecycle.yaml",
            "policy/history.csv"
          ],
          "touches_governed_paths": true
        },
        {
          "commit": "c9e9e5a763505c568acabcd885d4a97c5883380f",
          "author": "Yen-Ching Wu",
          "email": "yencwu87@gmail.com",
          "date": "2026-09-06T22:45:05+08:00",
          "message": "WB-015: correct eval_results and fix within_tolerance on missing metrics",
          "ticket_ref": "WB-015",
          "paths": [
            "caa/checks.py",
            "governance/tickets.csv"
          ],
          "touches_governed_paths": false
        },
        {
          "commit": "9fbe1c107afb80e18bc43bebcb4732ee63fbf953",